{
  "schema_version": "1.0",
  "meta": {
    "id": "catenary-arch",
    "created_at": "2026-10-17T12:00:00+03:00",
    "source": "manual",
    "notes": "Example: balanced default state"
  },
  "concept": {
    "name": "Catenary",
    "name_he": "שרשרת תלויה",
    "use": "קשת כניסה",
    "context_hint": "כיכר עירונית"
  },
  "generator": {
    "type": "sweep",
    "params": {
      "section": {
        "curve": "superellipse",
        "exponent": 6,
        "a": 2.2,
        "aspect": 0.2
      },
      "path": {
        "type": "arch",
        "span": 14,
        "height": 10
      },
      "twist": {
        "turns_per_lap": 0,
        "initial_angle_deg": 0
      },
      "scale_along_path": 1
    }
  },
  "bare": {
    "mode": "solid",
    "section_center_height": 0,
    "highlight": [
      "path"
    ]
  },
  "realistic": {
    "site": {
      "lat": 31.77,
      "lon": 35.21,
      "name": "Jerusalem"
    },
    "datetime": "2026-10-17T16:00:00+03:00",
    "weather": "clear",
    "orientation_deg": 0,
    "wind": { "from_deg": 270, "speed_ms": 5 },
    "materials": {
      "outer": "jerusalem_stone"
    },
    "context": {
      "preset": "urban_plaza",
      "vegetation": "olive_trees",
      "people": 8
    },
    "camera": {
      "preset": "eye_level_oblique",
      "height": 1.6,
      "fov_deg": 42,
      "aspect": "3:2"
    }
  },
  "narrative": {
    "name_he": "שער השרשרת",
    "insight": "שרשרת שתלויה בין שתי נקודות מקבלת צורה שבה כל חוליה במתיחה בלבד. הפוכה, היא קשת שבה האבן עובדת בלחיצה בלבד, בלי כפיפה. מפתח של 14 מ' וגובה של 10 מ' יוצרים סף ברור בין הכיכר לרחוב, בדופן דקה של 88 ס\"מ.",
    "maxim": "הכוח זורם בצורה.",
    "fit_note": null
  }
}
