{
  "schema_version": "1.0",
  "meta": {
    "id": "klein-bottle-pavilion",
    "created_at": "2026-10-17T12:00:00+03:00",
    "source": "manual",
    "notes": "Example: balanced default state, parametric surface"
  },
  "concept": {
    "name": "Klein bottle",
    "name_he": "בקבוק קליין",
    "use": "פסל סביבתי",
    "context_hint": "פארק"
  },
  "generator": {
    "type": "parametric_surface",
    "params": {
      "family": "klein_bottle",
      "radius": 8,
      "tube": 3
    }
  },
  "bare": {
    "mode": "shell",
    "section_center_height": 0,
    "shell": {
      "thickness": 0.25,
      "inner_method": "normal_offset"
    }
  },
  "realistic": {
    "site": {
      "lat": 31.8,
      "lon": 34.65,
      "name": "Ashdod"
    },
    "datetime": "2026-03-20T16:00:00+02:00",
    "weather": "clear",
    "orientation_deg": 0,
    "wind": { "from_deg": 270, "speed_ms": 5 },
    "materials": {
      "outer": "white_marble"
    },
    "context": {
      "preset": "park_lawn",
      "vegetation": "lawn_and_trees",
      "people": 8
    },
    "camera": {
      "preset": "eye_level_oblique",
      "height": 1.6,
      "fov_deg": 42,
      "aspect": "3:2"
    }
  },
  "narrative": {
    "name_he": "הטבעת שאין לה פנים",
    "insight": "חתך בצורת שמינייה מסתובב חצי סיבוב בהקפה אחת, ולכן מי שעוקב אחרי צד אחד של הדופן חוזר אליו מהצד השני. אין קצה ואין פנים מוגן: הפסל מראה משטח אחד שסוגר את עצמו בלי לסגור חלל.",
    "maxim": "צד אחד, בלי קצה.",
    "fit_note": "הבקבוק נבנה כהטבלת השמינייה, שחותכת את עצמה בטבעת אחת. במרחב שלושה-ממדי אין בקבוק קליין בלי חיתוך כזה."
  }
}
