{
  "schema_version": "1.0",
  "meta": {
    "id": "elliptic-gallery",
    "created_at": "2026-10-13T12:00:00+03:00",
    "source": "manual",
    "notes": "Example: balanced default state"
  },
  "concept": {
    "name": "Ellipse",
    "name_he": "אליפסה",
    "use": "גלריה",
    "context_hint": "חזית מים"
  },
  "generator": {
    "type": "sweep",
    "params": {
      "section": {
        "curve": "circle",
        "a": 2.6
      },
      "path": {
        "type": "ellipse",
        "R": 24,
        "R2": 14
      },
      "twist": {
        "turns_per_lap": 0,
        "initial_angle_deg": 0
      },
      "scale_along_path": 1
    }
  },
  "bare": {
    "mode": "shell",
    "section_center_height": 1.6,
    "shell": {
      "thickness": 0.25,
      "inner_method": "scaled_section"
    },
    "openings": {
      "passages": {
        "count": 2,
        "width": 3.6,
        "height": 2.6,
        "start_angle_deg": 0
      },
      "slots": {
        "count": 28,
        "width_fraction": 0.22,
        "duty": 0.45,
        "position": "near_edge"
      }
    },
    "floor": {
      "level": 0,
      "type": "chord"
    },
    "highlight": [
      "path"
    ]
  },
  "realistic": {
    "site": {
      "lat": 32.79,
      "lon": 34.99,
      "name": "Haifa"
    },
    "datetime": "2026-09-10T18:00:00+03:00",
    "weather": "clear",
    "materials": {
      "outer": "polished_concrete_grey",
      "inner": "polished_concrete_light",
      "floor": "timber_oak"
    },
    "context": {
      "preset": "waterfront",
      "vegetation": "none",
      "people": 12
    },
    "camera": {
      "preset": "eye_level_oblique",
      "height": 1.6,
      "fov_deg": 42,
      "aspect": "3:2"
    }
  },
  "narrative": {
    "name_he": "הגלריה בעלת שני המוקדים",
    "insight": "מסלול אליפטי סוגר חצר עם שני מוקדים: שתי נקודות שמכל מקום על הטבעת סכום המרחקים אליהן קבוע. ההולך בגלריה מתקרב לאחד ומתרחק מהשני, ומשני המעברים נשקף הים.",
    "maxim": "שני מרכזים, דרך אחת סביבם.",
    "fit_note": null
  }
}