{
  "schema_version": "1.0",
  "meta": {
    "id": "hyperboloid-water-tower",
    "created_at": "2026-10-17T12:00:00+03:00",
    "source": "manual",
    "notes": "Example: balanced default state, parametric surface"
  },
  "concept": {
    "name": "Hyperboloid of one sheet",
    "name_he": "היפרבולואיד חד-יריעתי",
    "use": "מגדל מים",
    "context_hint": "כיכר עירונית"
  },
  "generator": {
    "type": "parametric_surface",
    "params": {
      "family": "hyperboloid",
      "waist_radius": 3.2,
      "end_radius": 6,
      "height": 22
    }
  },
  "bare": {
    "mode": "shell",
    "section_center_height": 0,
    "shell": {
      "thickness": 0.18,
      "inner_method": "normal_offset"
    },
    "highlight": ["edges"]
  },
  "realistic": {
    "site": {
      "lat": 31.8,
      "lon": 34.65,
      "name": "Ashdod"
    },
    "datetime": "2026-04-15T16:30:00+03:00",
    "weather": "clear",
    "orientation_deg": 0,
    "wind": { "from_deg": 270, "speed_ms": 5 },
    "materials": {
      "outer": "polished_concrete_light",
      "inner": "concrete_matte"
    },
    "context": {
      "preset": "urban_plaza",
      "vegetation": "olive_trees",
      "people": 10
    },
    "camera": {
      "preset": "eye_level_oblique",
      "height": 1.6,
      "fov_deg": 42,
      "aspect": "3:2"
    }
  },
  "narrative": {
    "name_he": "המגדל שעשוי מקווים ישרים",
    "insight": "כל נקודה על המשטח המעוקל יושבת על שני קווים ישרים, ולכן אפשר לבנות אותו ממוטות ישרים בלבד. המותן הצרה באמצע היא המקום שבו שני הכיוונים נחתכים בצפיפות הגדולה ביותר, והיא מה שנותן למגדל את יציבותו.",
    "maxim": "מקווים ישרים נולד עיקול.",
    "fit_note": "הקליפה רציפה ואטומה: הקווים הישרים עצמם, והכניסה למגדל, עוד לא מסומנים במודל."
  }
}
