{
  "schema_version": "1.0",
  "meta": {
    "id": "pentacle-sculpture",
    "created_at": "2026-10-13T12:00:00+03:00",
    "source": "manual",
    "notes": "Example: balanced default state"
  },
  "concept": {
    "name": "Hypocycloid with five cusps",
    "name_he": "היפוציקלואיד בעל חמישה חודים",
    "use": "פסל סביבתי",
    "context_hint": "חוף ים"
  },
  "generator": {
    "type": "sweep",
    "params": {
      "section": {
        "curve": "hypocycloid",
        "cusps": 5,
        "a": 1.1
      },
      "path": {
        "type": "circle",
        "R": 14
      },
      "twist": {
        "turns_per_lap": 0.4,
        "initial_angle_deg": 0
      },
      "scale_along_path": 1
    }
  },
  "bare": {
    "mode": "solid",
    "section_center_height": 3.2,
    "highlight": [
      "edges"
    ]
  },
  "realistic": {
    "site": {
      "lat": 31.8,
      "lon": 34.65,
      "name": "Ashdod"
    },
    "datetime": "2026-10-13T17:30:00+03:00",
    "weather": "haze",
    "materials": {
      "outer": "corten_steel"
    },
    "context": {
      "preset": "coastal_dunes",
      "vegetation": "dune_shrubs_low",
      "people": 6
    },
    "camera": {
      "preset": "eye_level_oblique",
      "height": 1.6,
      "fov_deg": 42,
      "aspect": "3:2"
    }
  },
  "narrative": {
    "name_he": "הכוכב שמסתובב לאחד",
    "insight": "חמישה חודים מסתובבים שתי חמישיות בהקפה, ולכן כל קצה פוגש את שכנו השני עד שכל החמישה נעשים קצה אחד. הפסל סגור, והחצר שבתוכו פתוחה לים.",
    "maxim": "חמישה קווים, דרך אחת.",
    "fit_note": "הפסל הוא גוש מלא בקנה מידה של כיכר, ולא מבנה שנכנסים אליו."
  }
}