{
  "schema_version": "1.0",
  "meta": {
    "id": "helix-ramp",
    "created_at": "2026-10-13T12:00:00+03:00",
    "source": "manual",
    "notes": "Example: balanced default state"
  },
  "concept": {
    "name": "Helix",
    "name_he": "סליל",
    "use": "רמפת תצפית",
    "context_hint": "גבעות לס"
  },
  "generator": {
    "type": "sweep",
    "params": {
      "section": {
        "curve": "polygon",
        "sides": 4,
        "a": 2.2,
        "aspect": 0.12
      },
      "path": {
        "type": "helix",
        "R": 9,
        "pitch": 3.6,
        "turns": 3
      },
      "twist": {
        "turns_per_lap": 0,
        "initial_angle_deg": 0
      },
      "scale_along_path": 1
    }
  },
  "bare": {
    "mode": "solid",
    "section_center_height": 0.4,
    "highlight": [
      "path"
    ]
  },
  "realistic": {
    "site": {
      "lat": 31.25,
      "lon": 34.79,
      "name": "Beersheba"
    },
    "datetime": "2026-11-20T15:30:00+02:00",
    "weather": "clear",
    "orientation_deg": 30,
    "wind": { "from_deg": 315, "speed_ms": 4 },
    "materials": {
      "outer": "rammed_earth"
    },
    "context": {
      "preset": "desert_loess",
      "vegetation": "desert_acacia",
      "people": 8
    },
    "camera": {
      "preset": "eye_level_oblique",
      "height": 1.6,
      "fov_deg": 42,
      "aspect": "3:2"
    }
  },
  "narrative": {
    "name_he": "הרמפה שעולה סביב החלל",
    "insight": "הליכה בשיפוע של כשישה אחוזים מקיפה שלוש פעמים חלל ריק אחד ועולה כעשרה מטרים. כל הקפה פותחת את אותו אופק מגובה אחר, והחלל שבמרכז נשאר פתוח לשמיים.",
    "maxim": "מקיפים את הריק כדי לעלות.",
    "fit_note": null
  }
}