{
  "schema_version": "1.0",
  "meta": {
    "id": "astroid-pavilion",
    "created_at": "2026-10-13T12:00:00+03:00",
    "source": "manual",
    "notes": "Example: balanced default state"
  },
  "concept": {
    "name": "Astroid",
    "name_he": "אסטרואיד",
    "use": "ביתן הצללה",
    "context_hint": "כיכר עירונית"
  },
  "generator": {
    "type": "sweep",
    "params": {
      "section": {
        "curve": "hypocycloid",
        "cusps": 4,
        "a": 1.6
      },
      "path": {
        "type": "circle",
        "R": 17
      },
      "twist": {
        "turns_per_lap": 0.25,
        "initial_angle_deg": 0
      },
      "scale_along_path": 1
    }
  },
  "bare": {
    "mode": "shell",
    "section_center_height": 3.5,
    "shell": {
      "thickness": 0.25,
      "inner_method": "scaled_section"
    },
    "openings": {
      "passages": {
        "count": 4,
        "width": 3.2,
        "height": 3.6,
        "start_angle_deg": 0
      }
    },
    "floor": {
      "level": 1.0,
      "type": "chord"
    },
    "highlight": [
      "edges"
    ]
  },
  "realistic": {
    "site": {
      "lat": 32.08,
      "lon": 34.78,
      "name": "Tel Aviv"
    },
    "datetime": "2026-06-21T11:00:00+03:00",
    "weather": "clear",
    "materials": {
      "outer": "polished_concrete_light",
      "inner": "concrete_matte"
    },
    "context": {
      "preset": "urban_plaza",
      "vegetation": "none",
      "people": 14
    },
    "camera": {
      "preset": "eye_level_oblique",
      "height": 1.6,
      "fov_deg": 42,
      "aspect": "3:2"
    }
  },
  "narrative": {
    "name_he": "הצל בעל ארבעת החודים",
    "insight": "ארבעה חודים מסתובבים רבע סיבוב בהקפה ונפגשים לקצה אחד. הרצפה מוגבהת מטר מעל הכיכר, ומתחת לפאות הקעורות נפתח חלל מוצל שגובהו פי שלושה מאדם.",
    "maxim": "מה שחד מבחוץ הוא חלל מבפנים.",
    "fit_note": null
  }
}