{
  "schema_version": "1.0",
  "meta": {
    "id": "sine-promenade",
    "created_at": "2026-10-17T12:00:00+03:00",
    "source": "manual",
    "notes": "Example: balanced default state"
  },
  "concept": {
    "name": "Sine wave",
    "name_he": "גל סינוס",
    "use": "טיילת",
    "context_hint": "חזית מים"
  },
  "generator": {
    "type": "sweep",
    "params": {
      "section": {
        "curve": "circle",
        "a": 2.2
      },
      "path": {
        "type": "wave",
        "length": 120,
        "amplitude": 4,
        "wavelength": 40
      },
      "twist": {
        "turns_per_lap": 0,
        "initial_angle_deg": 0
      },
      "scale_along_path": 1
    }
  },
  "bare": {
    "mode": "shell",
    "section_center_height": 1.2,
    "shell": {
      "thickness": 0.25,
      "inner_method": "scaled_section"
    },
    "openings": {
      "slots": {
        "count": 30,
        "width_fraction": 0.3,
        "duty": 0.5,
        "position": "face_center"
      }
    },
    "floor": {
      "level": 0,
      "type": "chord"
    },
    "highlight": [
      "path"
    ]
  },
  "realistic": {
    "site": {
      "lat": 32.79,
      "lon": 34.99,
      "name": "Haifa"
    },
    "datetime": "2026-06-21T18:00:00+03:00",
    "weather": "clear",
    "orientation_deg": 0,
    "wind": { "from_deg": 270, "speed_ms": 5 },
    "materials": {
      "outer": "polished_concrete_light",
      "inner": "white_render",
      "floor": "timber_oak"
    },
    "context": {
      "preset": "waterfront",
      "vegetation": "none",
      "people": 14
    },
    "camera": {
      "preset": "eye_level_oblique",
      "height": 1.6,
      "fov_deg": 42,
      "aspect": "3:2"
    }
  },
  "narrative": {
    "name_he": "הטיילת הגלית",
    "insight": "מנהרה מקורה מתפתלת לאורך המים בשלושה גלים, ומתקרבת אל המים ומתרחקת מהם. פסי האור פונים תמיד לאותו צד, והגל מסובב אותם קדימה ואחורה, כך שההליכה מחליפה מבט פתוח ומחסה בקצב קבוע.",
    "maxim": "הקצב הוא הדרך.",
    "fit_note": null
  }
}
